{
  "export_id": "export-123",
  "source_key": "uploads/scope-1/source.csv",
  "filename": "source.csv",
  "status": "succeeded",
  "output": {
    "key": "exports/scope-1/export-123/source.csv",
    "download_filename": "source.csv"
  },
  "error": null,
  "created_at": "2026-03-25T00:00:00Z",
  "updated_at": "2026-03-25T00:01:00Z"
}
